Moat Type,Description,Sustainability,Examples,Vulnerabilities
Network Effects,User-generated prompt libraries and sharing,High,PromptBase marketplace,Open source alternatives
Data Advantage,Proprietary datasets for training and evaluation,Medium,Domain-specific prompt collections,Data can be replicated
Integration Lock-in,Deep integration with enterprise systems,High,Salesforce CRM integration,Standardization reduces lock-in
Specialized Expertise,Domain-specific prompt engineering knowledge,Medium,"Medical, legal, financial prompts",Expertise can be transferred
Technical Innovation,Superior algorithms and optimization,Low,Automated prompt optimization,Rapid innovation cycle
Brand and Trust,Established reputation and user trust,Medium,OpenAI Playground,New entrants can build trust
Ecosystem Effects,Complementary tools and services,High,LangChain ecosystem,Competitors can build ecosystems
Cost Efficiency,Lower cost per prompt optimization,Medium,Automated vs manual optimization,Technology commoditization
User Experience,Superior interface and usability,Low,Visual prompt builders,UX can be copied
Regulatory Compliance,Meeting enterprise compliance requirements,High,"SOC2, HIPAA compliance",Compliance can be achieved
Speed to Market,Faster deployment and iteration,Low,Real-time optimization,Speed advantages temporary
Community,Active user communities and support,Medium,Open source communities,Communities can migrate
API/Platform,Becoming the standard platform,High,LangChain as standard,Standards can shift
